<?xml version="1.0" encoding="utf-8" ?>
<GameDescriptor xmlns:xsi="http://www.w3.org/2001/XMLSchema-instance"
                xsi:noNamespaceSchemaLocation="JtaDescriptor.xsd"
                version="1" id="engText" root="false">
  <Texts defLang="eng">
    <Text id="playerHealthNameTxt">Hitpoints</Text>
    <Text id="torchNameTxt">Torch</Text>
    <Text id="torchDescTxt">This is a simple torch. There is a switch on it.</Text>
    <Text id="torchSwitchOnMenuTxt">Turn on</Text>
    <Text id="torchSwitchOnResponseTxt">You have turned on the torch.</Text>
    <Text id="torchSwitchOffMenuTxt">Turn off</Text>
    <Text id="torchSwitchOffResponseTxt">You have turned off the torch.</Text>
    <Text id="torchSwitchNameTxt">Torch</Text>
    <Text id="smallRoomNameTxt">Small room</Text>
    <Text id="smallRoomDescTxt">This is a simple small room. The light is weak, and it is really dark in the corners.</Text>
    <Text id="searchRoomMenuTxt">Look around</Text>
    <Text id="searchFailedTxt">You have found nothing interesting!</Text>
    <Text id="searchSucceededTxt">In the datk corner, a thing sparks in the light of the torch. It's a key!</Text>
    <Text id="doorKeyNameTxt">Key</Text>
    <Text id="neighbourSmallToBigMenuTxt">Through the door</Text>
    <Text id="doorIsClosedTxt">The door is locked.</Text>
    <Text id="blacksmithLine1Txt">Wellcome in my room!\nNow you have came so far, here is something for You!\nDo you want the pear or the apple?</Text>
    <Text id="pearAnswTxt">I want the pear!</Text>
    <Text id="appleAnswTxt">I want the apple!</Text>
    <Text id="takePearTxt">You have put the pear into your bag.</Text>
    <Text id="takeAppleTxt">You have put the apple into your bag.</Text>
    <Text id="blacksmithLine2Txt">I have nothing more for you! Good day!</Text>
    <Text id="pearNameTxt">Pear</Text>
    <Text id="appleNameTxt">Apple</Text>
    <Text id="pearDescTxt">This is a nice pear. Looks tasty!</Text>
    <Text id="appleDescTxt">This is a nice apple. Looks tasty!</Text>
    <Text id="eatPearMenuTxt">Eat the pear!</Text>
    <Text id="eatAppleMenuTxt">Eat the apple!</Text>
    <Text id="eatPearTxt">You have eaten the pear. Hmmm. It was reeaaaly good!</Text>
    <Text id="eatAppleTxt">##NOPE##</Text>
    <Text id="noMoreFruiteTxt">I am syrious! You get nothing more!</Text>
    <Text id="lookAtMenuTxt">I look it closer...</Text>
    <Text id="lookAtResponseTxt">The blacksmith is really ugly indeed... But there is a bucket next to him, full of nice fruits.</Text>
    <Text id="lookAtLaterResponseTxt">Now he doesn't seem so nice... I think he doesn't want me near anymore.</Text>
    <Text id="bigRoomNameTxt">Big room</Text>
    <Text id="bigRoomDescTxt">This is a biger room with a table in the middle, there is a paper on it.</Text>
    <Text id="paperNameTxt">Paper on the table</Text>
    <Text id="readPaparMenuTxt">Read</Text>
    <Text id="paperDescTxt">You read the following on the paper:\n"This was the first testgame for the Join-the-Adventure!\nThank you for tryin' it!"</Text>
    <Text id="neigbourBigToSmallMenuTxt">Back to the small room</Text>
    <Text id="npcBlacksmithNameTxt">Blacksmith</Text>
    <!--<Text id="npcBlacksmithDescTxt">The blackmisth is standing in the other part of the room. By the way, he is really ugly.</Text> -->
    <Text id="gameNameTxt">Awesome Test Game</Text>
    <Text id="gameDescTxt">This is only a test game.</Text>
    <Text id="appleDeathTxt">The apple was great. But when u finish with the last bite, you can feel something wrong.\nSuddenly you fall down dead.\nGame Over.</Text>
    <Text id="gameOverTxt">GAME OVER</Text>
    <Text id="jtaLabelInventory">Backpack</Text>
    <Text id="jtaLabelGoNextRoom">Go further...</Text>
    <Text id="jtaLabelMenu">Menu</Text>
    <Text id="jtaLabelPickUp">Take it</Text>
    <Text id="jtaLabelBack">Back</Text>
    <Text id="jtaLabelItems">Items</Text>
    <Text id="jtaLabelPickUpNotif">You have taken the</Text>
    <Text id="jtaLabelNpc">Npcs</Text>
    <Text id="jtaLabelShowDescription">Make a better look...</Text>
    <Text id="jtaLabelStartConversation">Start conversation</Text>
    <Text id="jtaLabelConversationWith">Conversation with </Text>
  </Texts>
</GameDescriptor>